{
  "version": 3,
  "name": "La chasse aux couleurs",
  "description": "<p>Les enfants partent à la recherche d'objets de la couleur annoncée par l'animateur et les rapportent au camp de base. Un jeu <strong>simple et rapide</strong>, idéal pour faire bouger un petit groupe.</p>",
  "visualBrief": "Un groupe d'enfants courant vers un cerceau rempli d'objets colorés.",
  "classification": {
    "format": "SMALL_GAME",
    "practices": [],
    "themes": ["Couleurs"]
  },
  "imaginary": {
    "rule": "ADAPTABLE",
    "universes": ["Pirates"]
  },
  "audience": {
    "ageMin": 3,
    "ageMax": 6,
    "participantsMin": 4,
    "participantsMax": 12,
    "childrenPace": "DYNAMIC",
    "ageVariants": "<p>Pour les 3-4 ans, limiter à trois couleurs.</p>"
  },
  "supervision": {
    "hostEffort": "MEDIUM",
    "hostsRequired": 1,
    "crossSupervision": false,
    "notes": ""
  },
  "place": {
    "indoor": false,
    "outdoor": true,
    "locations": ["PARK"],
    "conditions": "<p>Un espace dégagé et délimité, sans obstacle.</p>",
    "seasons": ["SPRING", "SUMMER"]
  },
  "safety": {
    "instructions": ["Premiers secours"]
  },
  "pedagogy": {
    "goals": ["Écoute"],
    "idealFor": ["Se dépenser"],
    "development": {
      "DEVELOP_PHYSICAL": ["Motricité globale"],
      "DEVELOP_INTELLECTUAL": ["Formes"],
      "DEVELOP_AFFECT": [],
      "DEVELOP_SOCIAL": ["Coopération"],
      "DEVELOP_MORAL": [],
      "DEVELOP_SPIRITUAL": []
    }
  },
  "materials": [
    { "name": "Cerceau", "quantity": "1" },
    { "name": "Craie", "quantity": "" }
  ],
  "workshops": [],
  "steps": [
    {
      "kind": "PREPARE",
      "title": "Préparer le jeu",
      "duration": 5,
      "description": "<p>Ce que l'animateur installe avant que les enfants ne commencent.</p>",
      "actions": [
        "Délimiter l'espace de jeu à la craie.",
        "Poser le cerceau au centre : c'est le camp de base."
      ],
      "materials": ["Craie", "Cerceau"],
      "tips": []
    },
    {
      "kind": "CUSTOM",
      "title": "Expliquer l'activité",
      "duration": 3,
      "description": "",
      "actions": [
        "Annoncer une couleur.",
        "Montrer un exemple d'objet de cette couleur."
      ],
      "materials": [],
      "tips": []
    },
    {
      "kind": "CUSTOM",
      "title": "Lancer le jeu",
      "duration": 15,
      "description": "",
      "actions": [
        "Annoncer la couleur et donner le départ.",
        "Vérifier les objets rapportés au camp de base."
      ],
      "materials": [],
      "tips": []
    },
    {
      "kind": "CUSTOM",
      "title": "Annoncer la fin de l'activité",
      "duration": 2,
      "description": "",
      "actions": [
        "Prévenir les enfants avant l'arrêt effectif plutôt que de couper l'activité net."
      ],
      "materials": [],
      "tips": []
    },
    {
      "kind": "CONCLUSION",
      "title": "Conclusion",
      "duration": 2,
      "description": "",
      "actions": ["Féliciter l'ensemble des participants."],
      "materials": [],
      "tips": []
    }
  ]
}
